,Title,Type,Cast,Country,Release Year,Date Added,Rating,Duration,Vote Average
173,Wild Yellowstone,TV Show,Bart Thomasson,Germany,2015,"November 12, 2019",TV-PG,1 Season,7.5
174,Life Below Zero,TV Show,"Chip Hailstone, Agnes Hailstone, Sue Aikens, Andy Bassich",United States,2012,"September 15, 2021",TV-14,16 Seasons,7.5
175,Marvel's 616,TV Show,Unknown,United States,2020,"November 20, 2020",TV-14,1 Season,7.5
176,Iron Man Armored Adventures,TV Show,"Adrian Petriw, Daniel Bacon, Anna Cummer, Mackenzie Gray, Vincent Tong",Canada,2008,"November 12, 2019",TV-G,2 Seasons,7.5
177,Iron Man Armored Adventures,TV Show,"Adrian Petriw, Daniel Bacon, Anna Cummer, Mackenzie Gray, Vincent Tong", United States,2008,"November 12, 2019",TV-G,2 Seasons,7.5
178,Iron Man Armored Adventures,TV Show,"Adrian Petriw, Daniel Bacon, Anna Cummer, Mackenzie Gray, Vincent Tong", United Kingdom,2008,"November 12, 2019",TV-G,2 Seasons,7.5
179,Iron Man Armored Adventures,TV Show,"Adrian Petriw, Daniel Bacon, Anna Cummer, Mackenzie Gray, Vincent Tong", France,2008,"November 12, 2019",TV-G,2 Seasons,7.5
180,Iron Man Armored Adventures,TV Show,"Adrian Petriw, Daniel Bacon, Anna Cummer, Mackenzie Gray, Vincent Tong", Luxembourg,2008,"November 12, 2019",TV-G,2 Seasons,7.5
181,Gabby Duran And The Unsittables,TV Show,"Kylie Cantrall, Maxwell Donovan, Callan Farris, Coco Christo, Valery Ortiz, Nathan Lovejoy",United States,2018,"August 11, 2021",TV-G,2 Seasons,7.476
182,Marvel's Runaways,TV Show,"Rhenzy Feliz, Lyrica Okano, Virginia Gardner, Ariela Barer, Gregg Sulkin, Allegra Acosta",United States,2017,"January 10, 2020",TV-14,3 Seasons,7.47
183,Tangled: The Series,TV Show,"Zachary Levi, Mandy Moore, Eden Espinosa, Clancy Brown",United States,2016,"April 23, 2020",TV-Y7,3 Seasons,7.446
184,Magic of Disney's Animal Kingdom,TV Show,Josh Gad,United Kingdom,2020,"September 25, 2020",TV-PG,1 Season,7.444
185,Marvel Studios LEGENDS,TV Show,Unknown,United States,2021,"January 8, 2021",TV-14,1 Season,7.421
186,Silver Surfer,TV Show,"Paul Essiembre, James Blendick, Robert Bockstael, Jennifer Daley, Colin Fox",United States,1997,"November 12, 2019",TV-Y7,1 Season,7.403
187,Silver Surfer,TV Show,"Paul Essiembre, James Blendick, Robert Bockstael, Jennifer Daley, Colin Fox", Canada,1997,"November 12, 2019",TV-Y7,1 Season,7.403
188,Dug Days,TV Show,"Bob Peterson, Ed Asner, Jordan Nagai",United States,2021,"September 1, 2021",TV-PG,1 Season,7.4
189,Disney Just Roll With It,TV Show,"Ramon Reed, Kaylin Hayman, Suzi Barrett, Tobie Windham",United States,2018,"June 18, 2021",TV-Y7,2 Seasons,7.4
190,Muppet Moments (Shorts),TV Show,Unknown,United States,2014,"November 12, 2019",TV-Y7,1 Season,7.4
191,Dino Ranch,TV Show,"Tyler Nathan, Jacob Mazeral, Ava Ro, Scott Gorman, Athena Karkanis",Canada,2021,"June 18, 2021",TV-Y,1 Season,7.4
192,Mickey Mouse (Shorts),TV Show,Unknown,United States,2012,"November 12, 2019",TV-G,5 Seasons,7.4
193,Mickey Mouse Club (1955-59),TV Show,Unknown,United States,1955,"November 12, 2019",TV-PG,1 Season,7.4
194,Spider-Man Unlimited,TV Show,"Rino Romano, Kathleen Barr, Jim Byrnes, Garry Chalk, Paul Dobson",United States,1999,"November 12, 2019",TV-Y7,1 Season,7.4
195,Spider-Man Unlimited,TV Show,"Rino Romano, Kathleen Barr, Jim Byrnes, Garry Chalk, Paul Dobson", Canada,1999,"November 12, 2019",TV-Y7,1 Season,7.4
196,Behind the Attraction,TV Show,Paget Brewster,Unknown,2021,"July 21, 2021",TV-PG,1 Season,7.4
197,Disney's Adventures Of The Gummi Bears,TV Show,"Bill Scott, Christian Jacobs, Brett Johnson, David Faustino, Paul Winchell, Jason Marsden",United States,1985,"November 12, 2019",TV-Y7,6 Seasons,7.386
198,Spidey And His Amazing Friends,TV Show,"Benjamin Valic, Lily Sanfelippo, Jakari Fraser, Dee Bradley Baker, Melanie Minichino",United States,2021,"September 22, 2021",TV-Y,1 Season,7.374
199,Spider-Man and His Amazing Friends,TV Show,"Hans Conried, Jerry Dexter, George DiCenzo, Alan Dinehart, Walker Edminston, Michael Evans",United States,1982,"November 12, 2019",TV-Y7,1 Season,7.353
200,Marvel Studios ASSEMBLED,TV Show,Unknown,Unknown,2021,"March 12, 2021",Unknown,1 Season,7.35
201,Disney Gallery / Star Wars: The Mandalorian,TV Show,"Jon Favreau, Dave Filoni, Pedro Pascal, Bryce Howard, Taika Waititi, Carl Weathers",United States,2020,"December 25, 2020",TV-PG,2 Seasons,7.343
202,Lizzie McGuire,TV Show,"Hilary Duff, Lalaine , Adam Lamberg, Jake Thomas, Hallie Todd, Robert Carradine",United States,2000,"November 12, 2019",TV-G,2 Seasons,7.337
203,Once Upon a Time,TV Show,"Ginnifer Goodwin, Jennifer Morrison, Robert Carlyle, Lana Parrilla, Jared Gilmore, Josh Dallas",United States,2011,"September 18, 2020",TV-PG,7 Seasons,7.316
204,Supercar Megabuild,TV Show,Dom Joly,United States,2016,"December 1, 2019",TV-PG,2 Seasons,7.313
205,Disney K.C. Undercover,TV Show,"Zendaya , Veronica Dunne, Kamil McFadden, Tammy Townsend, Kadeem Hardison",United States,2014,"November 12, 2019",TV-Y7,3 Seasons,7.3
206,Disney Lab Rats: Elite Force,TV Show,"William Brent, Bradley Perry, Jake Short, Paris Berelc, Kelli Berglund",United States,2015,"November 12, 2019",TV-Y7,1 Season,7.3
207,Disney Legend of the Three Caballeros,TV Show,"Tony Anselmo, Jaime Camil, Eric Bauza, Grey Griffin, Wayne Knight, Kevin Richardson",United States,2017,"November 12, 2019",TV-G,1 Season,7.3
208,Disney Junior Music Nursery Rhymes,TV Show,Unknown,Unknown,2017,"November 12, 2019",TV-Y,2 Seasons,7.3
209,Earth Moods,TV Show,Unknown,Unknown,2021,"April 16, 2021",TV-G,1 Season,7.3
210,101 Dalmatian Street,TV Show,"Josh Brener, Michaela Dietz, Ella Kenion, Rhashan Stone",United Kingdom,2018,"February 28, 2020",TV-Y7,1 Season,7.3
211,101 Dalmatian Street,TV Show,"Josh Brener, Michaela Dietz, Ella Kenion, Rhashan Stone", United States,2018,"February 28, 2020",TV-Y7,1 Season,7.3
212,101 Dalmatian Street,TV Show,"Josh Brener, Michaela Dietz, Ella Kenion, Rhashan Stone", Canada,2018,"February 28, 2020",TV-Y7,1 Season,7.3
213,Disney Descendants Wicked World (Shorts),TV Show,Unknown,United States,2015,"November 12, 2019",TV-G,2 Seasons,7.265
214,Disney Bizaardvark,TV Show,"Madison Hu, Olivia Rodrigo, Jake Paul, DeVore Ledridge, Ethan Wacker",United States,2015,"November 12, 2019",TV-PG,3 Seasons,7.265
215,Disney DuckTales (Shorts),TV Show,Unknown,Unknown,2016,"November 12, 2019",TV-Y7,1 Season,7.265
216,Darkwing Duck,TV Show,"Jim Cummings, Christine Cavanaugh, Terry McGovern, Frank Welker",United States,1991,"November 12, 2019",TV-Y7,2 Seasons,7.265
217,Disney Evermoor,TV Show,"Naomi Sequeira, Jordan Loughran, Belinda Stewart-Wilson, Dan Fredenburgh, George Sear, Georgie Farmer",Unknown,2017,"November 12, 2019",TV-PG,1 Season,7.265
218,Pixar Popcorn,TV Show,"Ellen DeGeneres, Craig T. Nelson, Holly Hunter, Keegan-Michael Key, Jordan Peele",United States,2021,"January 22, 2021",TV-PG,1 Season,7.263
219,Encore!,TV Show,"Kristen Bell, Roger Love, Susan Egan, Ali Stroker, Stephen Schwartz",United States,2019,"November 12, 2019",TV-14,1 Season,7.26
220,It's a Dog's Life with Bill Farmer,TV Show,Bill Farmer,United States,2020,"May 15, 2020",TV-PG,1 Season,7.25
221,Prairie Dog Manor,TV Show,Kevin Conway,United States,2019,"May 1, 2020",TV-PG,1 Season,7.25
222,America's National Parks,TV Show,C.T. Taylor,United States,2015,"January 15, 2020",TV-14,1 Season,7.25
223,Iron Man (Series),TV Show,"Robert Hays, James Avery, Ed Gilbert, Jim Cummings, Tony Steedman, James Warwick",United States,1994,"November 12, 2019",TV-Y7,1 Season,7.244
224,The Right Stuff,TV Show,"Jake McDorman, Patrick Adams, Colin O’Donoghue, Eloise Mumford, James Lafferty, Nora Zehetner",United States,2020,"October 9, 2020",TV-14,1 Season,7.236
225,Timon & Pumbaa,TV Show,"Quinton Flynn, Ernie Sabella, Jim Cummings, Nathan Lane",United States,1995,"November 12, 2019",TV-Y,3 Seasons,7.234
226,Super Robot Monkey Team Hyperforce Go!,TV Show,"Greg Cipes, Kevin Michael	Richardson, Tom Kenny, Kari Wahlgren, Clancy Brown, Corey Feldman",United States,2004,"July 17, 2020",TV-Y7,2 Seasons,7.233
227,Super Robot Monkey Team Hyperforce Go!,TV Show,"Greg Cipes, Kevin Michael	Richardson, Tom Kenny, Kari Wahlgren, Clancy Brown, Corey Feldman", Japan,2004,"July 17, 2020",TV-Y7,2 Seasons,7.233
228,Marvel's Guardians of the Galaxy (Shorts),TV Show,Unknown,Unknown,2014,"November 12, 2019",TV-Y7,2 Seasons,7.224
229,Origins: The Journey of Humankind,TV Show,"Mark Monroe, Jason Silva",United States,2016,"November 12, 2019",TV-14,1 Season,7.222
230,Disney's Doug,TV Show,"Connie Shulman, Doug Preis, Alice Playten, Chris Phillips, Fred Newman, Thomas McHugh",United States,1996,"November 12, 2019",TV-Y7,3 Seasons,7.213
231,Disney's Hercules: The Animated Series,TV Show,"Tate Donovan, Sandra Bernhard, Robert Costanzo, Matt Frewer, Bobcat Goldthwait, French Stewart",United States,1998,"November 12, 2019",TV-Y7,1 Season,7.213
232,Fantastic Four (Series),TV Show,"Beau Weaver, Lori Alan, Chuck McCann, Brian Green, Stan Lee, Pauline Lomas",United States,1994,"November 12, 2019",TV-Y7,1 Season,7.202
233,Hannah Montana,TV Show,"Miley Cyrus, Emily Osment, Mitchel Musso, Jason Earles, Billy Cyrus",United States,2005,"November 12, 2019",TV-G,4 Seasons,7.202
234,Even Stevens,TV Show,"Shia LaBeouf, Christy Romano, Nick Spano, Tom Virtue, Donna Pescow",United States,2000,"November 12, 2019",TV-PG,3 Seasons,7.202
235,Star Wars: Visions,TV Show,Unknown,Unknown,2021,"September 22, 2021",TV-PG,1 Season,7.2
236,Kingdom of the White Wolf,TV Show,Jenny Jules,United States,2019,"November 12, 2019",TV-PG,1 Season,7.2
237,Fairy Tale Weddings,TV Show,"Stephen Boss, Allison Holker",United States,2017,"February 14, 2020",TV-PG,2 Seasons,7.2
238,"Heartland Docs, DVM",TV Show,"Dr. Erin Schroeder, Dr. Ben Schroeder",United States,2019,"June 18, 2021",TV-14,3 Seasons,7.2
239,Olaf Presents,TV Show,Josh Gad,Unknown,2021,"November 12, 2021",TV-PG,1 Season,7.2
240,Disney Amphibia,TV Show,"Justin Felbinger, Amanda Leighton, Bill Farmer, Brenda Song",United States,2018,"November 3, 2021",TV-Y7,3 Seasons,7.2
241,Disney Amphibia,TV Show,"Justin Felbinger, Amanda Leighton, Bill Farmer, Brenda Song", South Korea,2018,"November 3, 2021",TV-Y7,3 Seasons,7.2
242,Turner & Hooch,TV Show,"Josh Peck, Carra Patterson, Lyndsy Fonseca, Vanessa Lengies, Brandon Jay Mclaren, Anthony Ruivivar",Unknown,2021,"July 21, 2021",TV-PG,1 Season,7.2
243,Secrets Of The Zoo: Down Under,TV Show,Naomi Watts,Unknown,2020,"October 13, 2021",TV-14,2 Seasons,7.2
244,Just Beyond,TV Show,"Mckenna Grace, Lexi Underwood, Cedric Joe, Tim Heidecker, Riki Lindhome, Nasim Pedrad",Unknown,2021,"October 13, 2021",TV-PG,1 Season,7.192
245,The Incredible Hulk,TV Show,"Neal McDonough, John Vernon, Luke Perry, Lou Ferrigno, Genie Francis",United States,1996,"May 10, 2021",TV-Y7,2 Seasons,7.19
246,That's So Raven,TV Show,"Raven , Orlando Brown, Kyle Massey, Anneliese van der Pol, T’Keyah Keymáh, Rondell Sheridan",United States,2002,"February 8, 2020",TV-G,4 Seasons,7.183
247,Monsters at Work,TV Show,"Billy Crystal, John Goodman, Ben Feldman, Mindy Kaling, Henry Winkler, Lucas Neff",United States,2021,"July 7, 2021",TV-G,1 Season,7.174
248,Europe from Above,TV Show,Julian Barratt,United Kingdom,2019,"September 18, 2020",TV-G,1 Season,7.167
249,Port Protection Alaska,TV Show,"Gary Muehlberger, Mary Miller, Curly Leach, Sam Carlson, Stuart Andrews, David Squibb",United States,2015,"November 24, 2021",TV-14,2 Seasons,7.143
250,Diary of a Future President,TV Show,"Tess Romero, Selenis Leyva, Charlie Bushnell, Michael Weaver",United States,2020,"January 17, 2020",TV-PG,2 Seasons,7.13
251,So Random!,TV Show,"Tiffany Thornton, Sterling Knight, Brandon Mychal Smith, Doug Brochu, Allisyn Ashley Arm",United States,2011,"July 14, 2021",TV-G,1 Season,7.118
252,TaleSpin,TV Show,"Charlie Adler, Jim Cummings, Ed Gilbert, Chuck McCann, Alan Roberts, Sally Struthers",United States,1990,"November 12, 2019",TV-G,1 Season,7.11
253,Wicked Tuna,TV Show,Mike Rowe,United States,2016,"May 28, 2021",TV-14,10 Seasons,7.1
254,Phil of the Future,TV Show,"Ricky Ullman, Amy Bruckner, Craig Anton, Lise Simms, Alyson Michalka",United States,2003,"November 12, 2019",TV-G,2 Seasons,7.1
255,LEGO Star Wars: The Freemaker Adventures (Shorts),TV Show,Unknown,Unknown,2016,"November 12, 2019",TV-Y7,1 Season,7.1
256,LEGO Star Wars: The Freemaker Adventures,TV Show,"Matt Sloan, Trevor Devall, Greg Baldwin, Michael Daingerfield, Vanessa Lengies, Grey Griffin",United States,2015,"November 12, 2019",TV-Y7,2 Seasons,7.1
257,Running Wild with Bear Grylls,TV Show,Bear Grylls,United States,2019,"June 25, 2021",TV-PG,2 Seasons,7.1
258,Pick of the Litter,TV Show,Unknown,United States,2019,"December 20, 2019",TV-PG,1 Season,7.0
259,Henry Hugglemonster,TV Show,"Lara Miller, Tom Kenny, Chiara Zanni, Lori Alan, Hynden Walch, Kari Wahlgren",Ireland,2012,"December 1, 2019",TV-Y,2 Seasons,7.0
260,Henry Hugglemonster,TV Show,"Lara Miller, Tom Kenny, Chiara Zanni, Lori Alan, Hynden Walch, Kari Wahlgren", United Kingdom,2012,"December 1, 2019",TV-Y,2 Seasons,7.0
261,Henry Hugglemonster,TV Show,"Lara Miller, Tom Kenny, Chiara Zanni, Lori Alan, Hynden Walch, Kari Wahlgren", United States,2012,"December 1, 2019",TV-Y,2 Seasons,7.0
262,Henry Hugglemonster,TV Show,"Lara Miller, Tom Kenny, Chiara Zanni, Lori Alan, Hynden Walch, Kari Wahlgren", South Korea,2012,"December 1, 2019",TV-Y,2 Seasons,7.0
263,Henry Hugglemonster,TV Show,"Lara Miller, Tom Kenny, Chiara Zanni, Lori Alan, Hynden Walch, Kari Wahlgren", Canada,2012,"December 1, 2019",TV-Y,2 Seasons,7.0
264,Disney Insider,TV Show,Unknown,United States,2020,"March 20, 2020",TV-PG,1 Season,7.0
265,Marvel's Rocket & Groot (Shorts),TV Show,Unknown,Unknown,2016,"November 12, 2019",TV-Y7,1 Season,7.0
266,Buried Secrets Of The Bible With Albert Lin,TV Show,Albert Lin,Unknown,2019,"May 1, 2020",TV-PG,1 Season,7.0
267,Once Upon a Time in Wonderland,TV Show,"Sophie Lowe, Michael Socha, Peter Gadiot, Emma Rigby, Naveen Andrews, John Lithgow",Canada,2013,"November 27, 2020",TV-PG,1 Season,7.0
268,Once Upon a Time in Wonderland,TV Show,"Sophie Lowe, Michael Socha, Peter Gadiot, Emma Rigby, Naveen Andrews, John Lithgow", United States,2013,"November 27, 2020",TV-PG,1 Season,7.0
269,Disney Vampirina Ghoul Girls Rock! (Shorts),TV Show,"Isabella Crovetti, Jordan Davis, ViviAnn Yee, Mitchell Whitfield, Wanda Sykes, Ian Corlett",Unknown,2017,"March 20, 2020",TV-Y7,2 Seasons,7.0
270,Higglytown Heroes,TV Show,"Frankie Ryan Manriquez, Taylor Masamitsu, Liliana Mumy, Rory Thost, Edie McClurg",United States,2004,"April 2, 2021",TV-Y,2 Seasons,7.0
271,Higglytown Heroes,TV Show,"Frankie Ryan Manriquez, Taylor Masamitsu, Liliana Mumy, Rory Thost, Edie McClurg", South Korea,2004,"April 2, 2021",TV-Y,2 Seasons,7.0
272,Breaking Bobby Bones,TV Show,Bobby Bones,United States,2021,"July 7, 2021",TV-14,1 Season,7.0
273,Shark Attack Files,TV Show,Unknown,Unknown,2021,"July 16, 2021",TV-14,1 Season,7.0
274,Dog With a Blog,TV Show,"G Hannelius, Blake Michael, Francesca Capaldi, Stephen Full, Regan Burns, Beth Littleford",United States,2012,"February 26, 2021",TV-G,3 Seasons,6.995
275,Into the Unknown: Making Frozen 2,TV Show,"Kristen Bell, Idina Menzel, Josh Gad, Jonathan Groff, Jennifer Lee, Chris Buck",United States,2020,"June 26, 2020",TV-PG,1 Season,6.908
276,Disney Star vs. the Forces of Evil,TV Show,"Eden Sher, Adam McArthur",United States,2014,"December 1, 2019",TV-Y7,4 Seasons,6.9
277,Tut's Treasures: Hidden Secrets,TV Show,Mark Bazeley,United Kingdom,2018,"April 10, 2020",TV-PG,1 Season,6.9
278,Gigantosaurus,TV Show,"Dylan Schombing, Áine Sunderland, Nahanni Mitchell, Nicholas Holmes",France,2018,"August 25, 2021",TV-Y,2 Seasons,6.9
279,One Day at Disney (Shorts),TV Show,Unknown,Unknown,2019,"December 6, 2019",TV-PG,1 Season,6.9
280,Disney The Lion Guard,TV Show,"Max Charles, Diamond White, Dusan Brown, Atticus Shaffer, Joshua Rush",United States,2015,"December 3, 2019",TV-Y,3 Seasons,6.9
281,Mickey Mouse Roadster Racers,TV Show,"Bret Iwan, Russi Taylor, Bill Farmer, Daniel Ross, Tress MacNeille",Unknown,2017,"November 20, 2019",TV-Y,2 Seasons,6.8
282,Dog Whisperer with Cesar Millan,TV Show,Cesar Millan,United States,2004,"November 12, 2019",TV-G,6 Seasons,6.8
283,Becoming,TV Show,Unknown,United States,2020,"September 18, 2020",TV-PG,1 Season,6.8
284,Wild Sri Lanka,TV Show,Paul McGann,United Kingdom,2016,"July 24, 2020",TV-PG,1 Season,6.8
285,Japan: Between Earth and Sky,TV Show,Bray Poor,France,2017,"June 5, 2020",TV-PG,1 Season,6.8
286,Japan: Between Earth and Sky,TV Show,Bray Poor, Japan,2017,"June 5, 2020",TV-PG,1 Season,6.8
287,The World According to Jeff Goldblum,TV Show,Jeff Goldblum,United States,2019,"November 12, 2019",TV-PG,2 Seasons,6.8
288,The Evermoor Chronicles,TV Show,"Naomi Sequeira, Finney Cassidy, Georgia Lock, Jordan Loughran, George Sear, Georgie Farmer",United Kingdom,2015,"May 29, 2020",TV-PG,2 Seasons,6.8
289,The Evermoor Chronicles,TV Show,"Naomi Sequeira, Finney Cassidy, Georgia Lock, Jordan Loughran, George Sear, Georgie Farmer", United States,2015,"May 29, 2020",TV-PG,2 Seasons,6.8
290,Lost Treasures Of Egypt,TV Show,Rick Robles,United Kingdom,2018,"May 1, 2020",TV-PG,1 Season,6.8
291,Walk the Prank,TV Show,"Cody Veith, Bryce Gheisar, Brandon Severs, Jillian Shea Spaeder, Tobie Windham",United States,2016,"April 2, 2021",TV-Y7,3 Seasons,6.778
292,Inside Pixar,TV Show,Unknown,United States,2020,"November 13, 2020",TV-PG,1 Season,6.778
293,Pickle and Peanut,TV Show,"Johnny Pemberton, Jon Heder, Dana Snyder, Joel Trussell",United States,2015,"March 26, 2021",TV-Y7,2 Seasons,6.778
294,Elena of Avalor,TV Show,"Aimee Carrero, Jenna Ortega, Keith Ferguson, Jillian Reed, Carlos Alazraqui, Mikey Kelley",United States,2015,"January 15, 2021",TV-Y7,3 Seasons,6.758
295,Love & Vets,TV Show,Mallory Kasdan,United States,2017,"May 1, 2020",TV-PG,1 Season,6.755
296,Quack Pack,TV Show,"Tony Anselmo, James Avery, Brian Cummings, E.G. Daily, Jeannie Elias, Pamela Segall",United States,1996,"November 12, 2019",TV-Y,1 Season,6.755
297,Wild Hawaii,TV Show,JK Simmons,United States,2014,"June 5, 2020",TV-PG,1 Season,6.75
298,Disney Stuck In The Middle,TV Show,"Jenna Ortega, Ronni Hawk, Isaak Presley, Ariana Greenblatt, Kayla Maisonet, Nicolas Bechtel",United States,2015,"November 12, 2019",TV-PG,3 Seasons,6.747
299,Disney Take Two With Phineas And Ferb (Shorts),TV Show,Unknown,United States,2010,"November 12, 2019",TV-G,1 Season,6.747
300,Disney Tangled: The Series - Short Cuts,TV Show,Unknown,Unknown,2016,"November 12, 2019",TV-Y7,1 Season,6.747
301,Disney Minnie's Bow-Toons (Shorts),TV Show,Unknown,United States,2011,"November 12, 2019",TV-Y,3 Seasons,6.747
302,Disney Milo Murphy's Law,TV Show,"Al Yankovic, Sabrina Carpenter, Mekai Curtis",United States,2016,"November 12, 2019",TV-Y7,2 Seasons,6.747
303,Disney Mickey Mouse Clubhouse,TV Show,"Wayne Allwine, Jim Cummings, Russi Taylor, Tony Anselmo, Bill Farmer, Tress MacNeille",United States,2005,"November 12, 2019",TV-Y,5 Seasons,6.747
304,Handy Manny,TV Show,"Wilmer Valderrama, Carlos Alazraqui, Dee Baker, Nika Futterman, Tom Kenny, Kath Soucie",United States,2006,"November 12, 2019",TV-Y,3 Seasons,6.7
305,Handy Manny,TV Show,"Wilmer Valderrama, Carlos Alazraqui, Dee Baker, Nika Futterman, Tom Kenny, Kath Soucie", Canada,2006,"November 12, 2019",TV-Y,3 Seasons,6.7
306,Puppy Dog Pals,TV Show,"Harland Williams, Isaac Brown, Jessica DiCicco, Sam Lavagnino, Leslie Baker, Tara Strong",United States,2016,"June 11, 2021",TV-G,4 Seasons,6.7
307,Puppy Dog Pals,TV Show,"Harland Williams, Isaac Brown, Jessica DiCicco, Sam Lavagnino, Leslie Baker, Tara Strong", India,2016,"June 11, 2021",TV-G,4 Seasons,6.7
308,Crash & Bernstein,TV Show,"Cole Jensen, Tim Lagasse, Landry Bender, Oana Gregory, Aaron Landon",United States,2012,"November 12, 2019",TV-Y7,2 Seasons,6.667
309,Wild Cats of India,TV Show,James Murray,United States,2020,"August 14, 2020",TV-PG,1 Season,6.667
310,Zombies: Addison's Moonstone Mystery,TV Show,Unknown,Unknown,2020,"October 13, 2021",TV-G,1 Season,6.625
311,Out of the Box,TV Show,"Vivian Bayubay, Tony James, Jill Schackner, Aleisha Allen, Cece Cortes, Nicholas Eng",United States,1998,"November 12, 2019",TV-G,3 Seasons,6.6
312,Fish Hooks,TV Show,"Chelsea Kane, Kyle Massey, Justin Roiland",United States,2010,"April 3, 2020",TV-G,3 Seasons,6.6
313,Chip 'n' Dale: Park Life,TV Show,"Matthew Géczy, Kaycie Chase, Bill Farmer, Sylvain Caruso",Unknown,2021,"July 28, 2021",TV-Y7,1 Season,6.6
314,Star Wars Vehicle Flythroughs,TV Show,Unknown,Unknown,2021,"May 4, 2021",TV-G,1 Season,6.6
315,Disney Junior Muppet Babies Play Date,TV Show,Unknown,Unknown,2018,"June 19, 2020",TV-Y,1 Season,6.586
316,101 Dalmatians (Series),TV Show,"Jeff Bennett, Christine Cavanaugh, Tara Charendoff, Jim Cummings, Tress MacNeille, Charlotte Rae",Unknown,1997,"June 19, 2020",TV-Y7,1 Season,6.586
317,America's Funniest Home Videos,TV Show,Tom Bergeron,United States,1989,"April 24, 2020",TV-PG,9 Seasons,6.571
318,Spider-Man (Shorts),TV Show,Unknown,Unknown,2016,"November 12, 2019",TV-Y7,1 Season,6.545
319,So Weird,TV Show,"Cara DeLizia, Patrick Levis, Erik von Detten, Belinda Metz, Dave Ward, Mackenzie Phillips",Canada,1999,"November 12, 2019",TV-Y7,3 Seasons,6.545
320,The Replacements,TV Show,"Nancy Cartwright, Grey DeLisle, Kath Soucie, Daran Norris, David McCallum, Jeff Bennett",United States,2006,"November 12, 2019",TV-G,1 Season,6.511
321,Birth of Europe,TV Show,Mark Halliley,United Kingdom,2014,"May 1, 2020",TV-G,1 Season,6.5
322,Goof Troop,TV Show,"Nancy Cartwright, Jim Cummings, Dana Hill, Rob Paulson, Corey Burton, Bill Farmer",United States,1992,"November 12, 2019",TV-Y7,1 Season,6.5
323,Rogue Trip,TV Show,"Bob Woodruff, Mack Woodruff",Unknown,2020,"July 24, 2020",TV-PG,1 Season,6.5
324,Pepper Ann,TV Show,"Kathleen Wilhoite, Clea Lewis, Danny Cooksey, Pamela Segall, April Winchell, Don Adams",United States,1997,"September 8, 2021",TV-Y,3 Seasons,6.5
325,Disney Parks Sunrise Series,TV Show,Unknown,Unknown,2021,"December 18, 2020",TV-G,1 Season,6.5
326,Pixar In Real Life,TV Show,Unknown,United States,2019,"November 12, 2019",TV-G,1 Season,6.5
327,Storm Rising,TV Show,Unknown,Unknown,2021,"November 3, 2021",TV-14,1 Season,6.5
328,Rolie Polie Olie,TV Show,"Cole Caplan, Kristen Bone, Robert Smith, Catherine Disher, Adrian Truss, Len Carlson",Canada,1998,"September 29, 2021",TV-Y,5 Seasons,6.435
329,Rolie Polie Olie,TV Show,"Cole Caplan, Kristen Bone, Robert Smith, Catherine Disher, Adrian Truss, Len Carlson", United States,1998,"September 29, 2021",TV-Y,5 Seasons,6.435
330,Rolie Polie Olie,TV Show,"Cole Caplan, Kristen Bone, Robert Smith, Catherine Disher, Adrian Truss, Len Carlson", France,1998,"September 29, 2021",TV-Y,5 Seasons,6.435
331,The Book of Pooh,TV Show,"Jim Cummings, Paul Tiesler, Jeff Bennett, Peter Cullen, Stephanie d’Abruzzo, John Fiedler",United States,2000,"November 12, 2019",TV-Y,2 Seasons,6.4
332,LEGO Star Wars: Droid Tales,TV Show,"Tom Kane, Anthony Daniels, Trevor Devall, Kirby Morrow, Sam Vincent, Michael Donovan",United States,2014,"November 12, 2019",TV-Y7,1 Season,6.4
333,LEGO Star Wars: Resistance Rises (Shorts),TV Show,Unknown,United States,2015,"November 12, 2019",TV-Y7-FV,1 Season,6.4
334,LEGO Star Wars: Resistance Rises (Shorts),TV Show,Unknown, Denmark,2015,"November 12, 2019",TV-Y7-FV,1 Season,6.4
335,Marvel Super Hero Adventures,TV Show,Unknown,United States,2017,"October 23, 2020",TV-Y,4 Seasons,6.4
336,Growing Up Animal,TV Show,Tracee Ellis Ross,Unknown,2021,"August 18, 2021",TV-PG,1 Season,6.333
337,Star Wars Resistance,TV Show,"Christopher Sean, Josh Brener, Scott Lawrence, Suzie McGrath, As Himself",United States,2018,"February 25, 2020",TV-Y7,2 Seasons,6.327
338,X-Ray Earth,TV Show,Unknown,United States,2020,"October 30, 2020",TV-PG,1 Season,6.3
339,Marvel Rising: Initiation (Shorts),TV Show,Unknown,United States,2017,"November 12, 2019",TV-Y7,1 Season,6.3
340,Bonkers,TV Show,"Charlie Adler, Corey Burton, Jesse Corti, Jim Cummings, Frank Welker, Gregg Berger",United States,1993,"November 12, 2019",TV-G,1 Season,6.3
341,Bonkers,TV Show,"Charlie Adler, Corey Burton, Jesse Corti, Jim Cummings, Frank Welker, Gregg Berger", Hong Kong,1993,"November 12, 2019",TV-G,1 Season,6.3
342,Bonkers,TV Show,"Charlie Adler, Corey Burton, Jesse Corti, Jim Cummings, Frank Welker, Gregg Berger", South Korea,1993,"November 12, 2019",TV-G,1 Season,6.3
343,Bonkers,TV Show,"Charlie Adler, Corey Burton, Jesse Corti, Jim Cummings, Frank Welker, Gregg Berger", France,1993,"November 12, 2019",TV-G,1 Season,6.3
344,Bonkers,TV Show,"Charlie Adler, Corey Burton, Jesse Corti, Jim Cummings, Frank Welker, Gregg Berger", Canada,1993,"November 12, 2019",TV-G,1 Season,6.3
345,Bonkers,TV Show,"Charlie Adler, Corey Burton, Jesse Corti, Jim Cummings, Frank Welker, Gregg Berger", China,1993,"November 12, 2019",TV-G,1 Season,6.3
346,Bonkers,TV Show,"Charlie Adler, Corey Burton, Jesse Corti, Jim Cummings, Frank Welker, Gregg Berger", United Kingdom,1993,"November 12, 2019",TV-G,1 Season,6.3
347,Bonkers,TV Show,"Charlie Adler, Corey Burton, Jesse Corti, Jim Cummings, Frank Welker, Gregg Berger", Australia,1993,"November 12, 2019",TV-G,1 Season,6.3
348,Bonkers,TV Show,"Charlie Adler, Corey Burton, Jesse Corti, Jim Cummings, Frank Welker, Gregg Berger", Japan,1993,"November 12, 2019",TV-G,1 Season,6.3
349,Bonkers,TV Show,"Charlie Adler, Corey Burton, Jesse Corti, Jim Cummings, Frank Welker, Gregg Berger", Taiwan,1993,"November 12, 2019",TV-G,1 Season,6.3
350,Bonkers,TV Show,"Charlie Adler, Corey Burton, Jesse Corti, Jim Cummings, Frank Welker, Gregg Berger", Philippines,1993,"November 12, 2019",TV-G,1 Season,6.3
351,Among the Stars,TV Show,Chris Cassidy,Unknown,2021,"October 6, 2021",TV-PG,1 Season,6.3
352,Marvel's Future Avengers,TV Show,"英司 花輪, 一博 中谷, 康之 加瀬, 健一郎 松田, かおり 水橋, 史絵 水沢",Unknown,2017,"May 22, 2020",TV-Y7,2 Seasons,6.3
