,Title,Type,Cast,Country,Release Year,Date Added,Rating,Duration,Vote Average
353,Marvel Comics X-Men,TV Show,"Cedric Smith, Catherine Disher, Alyson Court, Chris Potter, George Buza, Iona Morris",United States,1992,"November 12, 2019",TV-Y7,5 Seasons,6.3
354,Marvel Comics X-Men,TV Show,"Cedric Smith, Catherine Disher, Alyson Court, Chris Potter, George Buza, Iona Morris", Canada,1992,"November 12, 2019",TV-Y7,5 Seasons,6.3
355,Marvel's Hero Project,TV Show,Unknown,United States,2019,"November 12, 2019",TV-PG,1 Season,6.3
356,Lost Treasures of the Maya,TV Show,Albert Lin,United States,2018,"November 12, 2019",TV-PG,1 Season,6.3
357,Lost Treasures of the Maya,TV Show,Albert Lin, Guatemala,2018,"November 12, 2019",TV-PG,1 Season,6.3
358,Out There with Jack Randall,TV Show,Jack Randall,Unknown,2019,"January 1, 2020",TV-14,1 Season,6.3
359,Shop Class,TV Show,Unknown,Unknown,2020,"February 28, 2020",TV-G,1 Season,6.3
360,Lost Cities With Albert Lin,TV Show,Dr. Albert Len,United States,2019,"February 21, 2020",TV-PG,1 Season,6.278
361,My Friends Tigger & Pooh,TV Show,Jim Cummings,United States,2006,"November 12, 2019",TV-Y,2 Seasons,6.263
362,Hulk and the Agents of S.M.A.S.H.,TV Show,"Fred Tatasciore, Clancy Brown, Seth Green, Eliza Dushku, Ben Diskin",United States,2012,"November 12, 2019",TV-Y7,2 Seasons,6.225
363,LEGO Star Wars: All Stars,TV Show,"Jasmin Brown, Josh Peck, Zeno Robinson, Max Mittelman, Matthew Wood",United States,2018,"November 12, 2019",TV-Y7,1 Season,6.2
364,LEGO Star Wars: All Stars (Shorts),TV Show,"Matthew Wood, Yvette Brown, Nicolas Cantu, Carolyn Hennesy, Montse Hernandez, Vanessa Lengies",Unknown,2018,"November 12, 2019",TV-Y7,1 Season,6.2
365,Marvel's Ultimate Comics,TV Show,"Cole Howard, Brian Drummond",Unknown,2016,"November 12, 2019",TV-Y7,1 Season,6.2
366,Race to the Center of the Earth,TV Show,Chris Payne Gilbert,United States,2021,"May 14, 2021",TV-14,1 Season,6.2
367,Disney Presents Goofy in How to Stay at Home,TV Show,"Bill Farmer, Corey Burton",Unknown,2021,"August 11, 2021",TV-G,1 Season,6.167
368,Kingdom of the Mummies,TV Show,Kerry Shale,United States,2020,"September 18, 2020",TV-14,1 Season,6.167
369,Sheriff Callie's Wild West,TV Show,"Mandy Moore, Lucas Grabeel",United States,2011,"December 1, 2019",TV-Y,2 Seasons,6.125
370,Sheriff Callie's Wild West,TV Show,"Mandy Moore, Lucas Grabeel", South Korea,2011,"December 1, 2019",TV-Y,2 Seasons,6.125
371,Sheriff Callie's Wild West,TV Show,"Mandy Moore, Lucas Grabeel", France,2011,"December 1, 2019",TV-Y,2 Seasons,6.125
372,Star Wars: Ewoks,TV Show,"Jim Henshaw, Cree Summer Francks, Jackie Burroughs, George Buza, Doug Chamberlain, Paul Chato",Unknown,1985,"April 2, 2021",TV-Y7-FV,2 Seasons,6.107
373,Doc McStuffins,TV Show,"Kiara Muhammad, Jaden Betts, Jess Harnell, Kimberly Brooks, Lara Miller, Loretta Devine",United States,2011,"May 22, 2020",TV-Y7,5 Seasons,6.057
374,Doc McStuffins,TV Show,"Kiara Muhammad, Jaden Betts, Jess Harnell, Kimberly Brooks, Lara Miller, Loretta Devine", Ireland,2011,"May 22, 2020",TV-Y7,5 Seasons,6.057
375,Marvel's Inhumans,TV Show,"Anson Mount, Serinda Swan, Ken Leung, Eme Ikwuakor, Isabelle Cornish, Ellen Woglom",United States,2017,"November 12, 2019",TV-14,1 Season,6.027
376,Imagination Movers,TV Show,"Rich Collins, Dave Poche, Scott Durbin, Scott Smith, Wendy Calio, Kevin Carlson",United States,2008,,TV-Y,3 Seasons,6.0
377,Fancy Nancy (Shorts),TV Show,"Mia Sinclair Jenness, Dana Heath, Spencer Moss, Alyson Hannigan",Unknown,2019,"November 6, 2020",TV-Y,1 Season,6.0
378,Kingdom of the Polar Bears,TV Show,Dennis Compayre,Unknown,2021,"May 28, 2021",TV-PG,1 Season,6.0
379,IMPACT with Gal Gadot,TV Show,Gal Gadot,United States,2021,"October 6, 2021",TV-14,1 Season,6.0
380,Star Wars Galaxy of Sounds,TV Show,Unknown,Unknown,2021,"September 29, 2021",TV-PG,1 Season,6.0
381,Jungle Animal Rescue,TV Show,Dan Nachtrab,United States,2019,"August 14, 2020",TV-PG,1 Season,6.0
382,Chicken Squad,TV Show,"Ramone Hamilton, Gabriella Graves, Maxwell Simkins, Yvette Nicole Brown",United States,2021,"August 11, 2021",TV-Y,1 Season,6.0
383,Critter Fixers: Country Vets,TV Show,Sullivan Jones,United States,2020,"July 28, 2021",TV-14,2 Seasons,6.0
384,Mickey Go Local,TV Show,"Azran Bin Ahmad, Rozita Binti Mohamed Hussain, Shamsir Bin Mohd Shahar, Suzana Binti Ahmad",Unknown,2019,"February 26, 2021",TV-G,1 Season,6.0
385,Austin & Ally,TV Show,"Ross Lynch, Laura Marano, Raini Rodriguez, Calum Worthy",United States,2011,"January 1, 2020",TV-G,4 Seasons,5.9
386,The Avengers: United They Stand,TV Show,"Martin Roach, Rod Wilson, Lenore Zann, Ron Rubin, Hamish McEwan, Lynda Ballantyne",France,1999,"November 12, 2019",TV-Y7,1 Season,5.9
387,The Avengers: United They Stand,TV Show,"Martin Roach, Rod Wilson, Lenore Zann, Ron Rubin, Hamish McEwan, Lynda Ballantyne", Canada,1999,"November 12, 2019",TV-Y7,1 Season,5.9
388,The Avengers: United They Stand,TV Show,"Martin Roach, Rod Wilson, Lenore Zann, Ron Rubin, Hamish McEwan, Lynda Ballantyne", United States,1999,"November 12, 2019",TV-Y7,1 Season,5.9
389,"Mira, Royal Detective",TV Show,"Leela Ladnier, Utkarsh Ambudkar, Roshni Edwards, Kal Penn, Kamran Lucas",United States,2020,"September 8, 2021",TV-Y,2 Seasons,5.9
390,MUPPET BABIES,TV Show,"Matt Danner, Melanie Harrison, Ben Diskin, Eric Bauza, Dee Baker, Jessica DiCicco",South Korea,2017,"June 4, 2021",TV-Y,3 Seasons,5.7
391,MUPPET BABIES,TV Show,"Matt Danner, Melanie Harrison, Ben Diskin, Eric Bauza, Dee Baker, Jessica DiCicco", United States,2017,"June 4, 2021",TV-Y,3 Seasons,5.7
392,MUPPET BABIES,TV Show,"Matt Danner, Melanie Harrison, Ben Diskin, Eric Bauza, Dee Baker, Jessica DiCicco", China,2017,"June 4, 2021",TV-Y,3 Seasons,5.7
393,MUPPET BABIES,TV Show,"Matt Danner, Melanie Harrison, Ben Diskin, Eric Bauza, Dee Baker, Jessica DiCicco", Japan,2017,"June 4, 2021",TV-Y,3 Seasons,5.7
394,Goldie & Bear,TV Show,"Georgie Kidder, Justine Huxley, Natalie Lander, Jim Cummings, David Kaufman, David Lodge",United States,2015,"November 6, 2020",TV-Y,2 Seasons,5.7
395,Earth to Ned,TV Show,Unknown,United States,2020,"September 4, 2020",TV-PG,1 Season,5.667
396,The Big Fib,TV Show,Unknown,United States,2019,"May 22, 2020",TV-PG,1 Season,5.6
397,Muppets Now,TV Show,"Dave Goelz, Matt Vogel, David Rudman, Peter Linz, Bill Barretta, Eric Jacobson",United States,2020,"July 31, 2020",TV-PG,1 Season,5.542
398,Fury Files,TV Show,Chi McBride,Unknown,2013,"May 21, 2021",TV-Y7,1 Season,5.5
399,Marvel Funko Shorts,TV Show,Unknown,Unknown,2016,"July 31, 2020",TV-Y7,2 Seasons,5.5
400,The Greeks,TV Show,Toby Moore,United States,2016,"June 5, 2020",TV-PG,1 Season,5.5
401,Wild Congo,TV Show,Corey Johnson,Unknown,2014,"July 24, 2020",TV-PG,1 Season,5.5
402,Star Wars Forces of Destiny (Shorts),TV Show,"Ashley Eckstein, Matt Lanter, C1-10P a.k.a. ""Chopper"" , John Boyega, Vanessa Marshall, Felicity Jones",United States,2016,"November 12, 2019",TV-Y7,2 Seasons,5.3
403,Billy Dilley's Super-Duper Subterranean Summer,TV Show,"Aaron Springer, Catherine Wayne, Tom Kenny",United States,2016,"January 1, 2020",TV-Y7,1 Season,5.3
404,Disney's Magic Bake-Off,TV Show,"Issac Ryan Brown, Dara Reneé, Graciela Gomez",United States,2021,"September 29, 2021",TV-G,1 Season,5.25
405,"Dr. Oakley, Yukon Vet",TV Show,"Dr. Michelle Oakley, Zachary Fine",United States,2013,"November 17, 2021",TV-PG,10 Seasons,5.2
406,Disney Fancy Nancy,TV Show,"Mia Jenness, Alyson Hannigan, Rob Riggle, Spencer Moss, Dana Heath",United States,2018,"November 12, 2021",TV-PG,3 Seasons,5.2
407,Disney Fancy Nancy,TV Show,"Mia Jenness, Alyson Hannigan, Rob Riggle, Spencer Moss, Dana Heath", Canada,2018,"November 12, 2021",TV-PG,3 Seasons,5.2
408,Star Wars: Blips,TV Show,Unknown,United States,2019,"November 12, 2019",TV-Y7-FV,1 Season,5.2
409,Star Wars Vintage: Droids,TV Show,"Anthony Daniels, R2-D2, Lesleh Donaldson, Andrew Sabiston, Don Francks, Dan Hennessey",Unknown,1985,"June 18, 2021",TV-Y7-FV,2 Seasons,5.1
410,Minnie's Bow-Toons: Party Palace Pals,TV Show,"Tress MacNeille, Nika Futterman, Kaitlyn Robrock",Unknown,2021,"July 28, 2021",TV-Y7,1 Season,5.056
411,Future-Worm!,TV Show,"Andy Milonakis, James Adomian, Corey Burton, Melanie Lynskey, Ryan Quincy, Neil deGrasse Tyson",United States,2016,"April 9, 2021",TV-Y7,1 Season,5.0
412,Paradise Islands,TV Show,Michael Izqueirdo,Unknown,2017,"April 10, 2020",TV-PG,1 Season,5.0
413,Muppet Babies Show and Tell (Shorts),TV Show,"Matt Danner, Melanie Harrison, Ben Diskin, Eric Bauza, Dee Baker, Jessica DiCicco",Unknown,2017,"January 15, 2020",TV-Y7,1 Season,5.0
414,Disney Randy Cunningham: 9th Grade Ninja,TV Show,"Ben Schwartz, Andrew Caldwell, Tim Curry, John DiMaggio, Kevin Richardson, Dave Wittenberg",United Kingdom,2011,"January 15, 2020",TV-Y7,2 Seasons,5.0
415,Disney Randy Cunningham: 9th Grade Ninja,TV Show,"Ben Schwartz, Andrew Caldwell, Tim Curry, John DiMaggio, Kevin Richardson, Dave Wittenberg", United States,2011,"January 15, 2020",TV-Y7,2 Seasons,5.0
416,Disney Randy Cunningham: 9th Grade Ninja,TV Show,"Ben Schwartz, Andrew Caldwell, Tim Curry, John DiMaggio, Kevin Richardson, Dave Wittenberg", Ireland,2011,"January 15, 2020",TV-Y7,2 Seasons,5.0
417,Weird But True!,TV Show,"Charlie Engelman, Kirby Engelman",United States,2017,"August 14, 2020",TV-G,3 Seasons,5.0
418,Spaced Out,TV Show,Ben DeTour,Unknown,2018,"August 14, 2020",TV-G,1 Season,5.0
419,Continent 7: Antarctica,TV Show,Chris Browning,United States,2016,"January 15, 2020",TV-PG,1 Season,5.0
420,Be Our Chef,TV Show,Angela Kinsey,Unknown,2020,"March 27, 2020",TV-G,1 Season,5.0
421,India From Above,TV Show,Dev Patel,Unknown,2019,"October 23, 2020",TV-PG,1 Season,5.0
422,Disney I Didn't Do It,TV Show,"Olivia Holt, Austin North, Piper Curda, Peyton Clark, Sarah Gilman",United States,2013,"March 20, 2020",TV-G,2 Seasons,5.0
423,Marvel Battleworld: Mystery of the Thanostones,TV Show,"Giles Panton, Rebecca Shoichet, Jesse Inocalla, Brad Swaile, Deven Mack, Ian Hanlin",United States,2020,"February 12, 2021",TV-Y7-FV,1 Season,5.0
424,Disney Fast Layne,TV Show,"Sophie Pollono, Sofia Rosinsky, Brandon Rossel, Winslow Fegley",United States,2018,"November 12, 2019",TV-G,1 Season,4.8
425,Disney JONAS,TV Show,"Kevin Jonas, Joe Jonas, Nick Jonas, Chelsea Staub, Nicole Anderson, John Ducey",United States,2008,"November 12, 2019",TV-G,2 Seasons,4.8
426,Disney Jake and the Never Land Pirates,TV Show,"Madison Pettis, Colin Ford, Jonathan Heit, David Arquette, Corey Burton",United States,2010,"November 12, 2019",TV-Y,4 Seasons,4.8
427,Disney Gravity Falls (Shorts),TV Show,Unknown,Unknown,2012,"November 12, 2019",TV-G,1 Season,4.8
428,Disney Gravity Falls,TV Show,"Kristen Schaal, Jason Morgan, Alex Hirsch",United States,2011,"November 12, 2019",TV-Y7,2 Seasons,4.8
429,America's Funniest Home Videos: Animal Edition,TV Show,Alfonso Ribeiro,Unknown,2021,"August 11, 2021",TV-PG,1 Season,4.8
430,Disney Family Sundays,TV Show,Unknown,United States,2019,"November 12, 2019",TV-G,1 Season,4.8
431,PJ Masks,TV Show,"Kyle Breitkopf, Jacob Ursomarzo, Addison Holley",France,2015,"October 20, 2021",TV-Y7,5 Seasons,4.682
432,PJ Masks,TV Show,"Kyle Breitkopf, Jacob Ursomarzo, Addison Holley", United Kingdom,2015,"October 20, 2021",TV-Y7,5 Seasons,4.682
433,Wild Nordic,TV Show,Dan Nachtrab,Unknown,2019,"December 18, 2020",TV-PG,1 Season,4.5
434,Turning the Tables with Robin Roberts,TV Show,Robin Roberts,Unknown,2021,"July 28, 2021",TV-PG,1 Season,3.5
435,Unlikely Animal Friends,TV Show,Mark Keller,United States,2012,"May 1, 2020",TV-G,3 Seasons,3.5
436,Wicked Tuna: Outer Banks,TV Show,Bill Ratner,Unknown,2013,"February 5, 2021",TV-14,7 Seasons,3.5
437,Dr. K's Exotic Animal ER,TV Show,"Dr. Susan Kelleher, Art Edmonds",Unknown,2014,"August 25, 2021",TV-14,9 Seasons,3.0
438,The Wild Life of Dr. Ole,TV Show,Unknown,Unknown,2021,"October 20, 2021",TV-PG,1 Season,3.0
439,Rocky Mountain Animal Rescue,TV Show,Chopper Bernet,United States,2018,"November 12, 2019",TV-PG,1 Season,2.0
440,Ready for Preschool,TV Show,Unknown,Unknown,2019,"September 29, 2021",TV-Y,2 Seasons,2.0
441,Gathering Storm,TV Show,Tucker McDougall,United States,2020,"October 23, 2020",TV-PG,1 Season,2.0
442,"Dr. T, Lone Star Vet",TV Show,Dr. Lauren Thielen,United States,2019,"November 12, 2019",TV-PG,1 Season,2.0
443,Secrets of the Zoo: North Carolina,TV Show,Unknown,Unknown,2020,"October 13, 2021",TV-14,1 Season,2.0
444,Elena of Avalor (Shorts),TV Show,"Aimee Carrero, Jenna Ortega, Maximus Riegel, Gia Lopez, Desmond Gerber, Mick Wingert",Unknown,2017,"November 12, 2019",TV-Y,2 Seasons,2.0
